{
  "$schema": "https://json-schema.org/draft/2020-12/schema",
  "type": "object",
  "required": ["feasible","meaningful_diff","blockers","files_changed","change_summary"],
  "properties": {
    "feasible": {"type": "string", "enum": ["YES","NO"]},
    "meaningful_diff": {"type": "string", "enum": ["YES","NO"]},
    "blockers": {"type": "array", "items": {"type": "string"}},
    "files_changed": {"type": "array", "items": {"type": "string"}},
    "change_summary": {"type": "array", "items": {"type": "string"}}
  },
  "additionalProperties": false
}
