{"feasible":"YES","meaningful_diff":"YES","blockers":[],"files_changed":["CHANGELOG.md","mlf2.cabal","src/MLF/Binding/BoundChildren.hs","src/MLF/Binding/Tree.hs","src/MLF/Binding/Validation.hs","test/BindingSpec.hs","tasks/todo/2026-03-09-bound-child-helper-consolidation/task_plan.md","tasks/todo/2026-03-09-bound-child-helper-consolidation/findings.md","tasks/todo/2026-03-09-bound-child-helper-consolidation/progress.md"],"change_summary":["Added a focused `BindingSpec` guard for the validation-adjacent direct-flex-child invariant via `checkNoGenFallback` before production refactoring.","Extracted `collectBoundChildren`, `tyVarChildFilter`, and `boundFlexChildren` into the new leaf module `src/MLF/Binding/BoundChildren.hs` so `MLF.Binding.Tree` and `MLF.Binding.Validation` share one implementation without a module cycle.","Removed the duplicate helper bodies from both `src/MLF/Binding/Tree.hs` and `src/MLF/Binding/Validation.hs`, updated imports, and registered the new module in `mlf2.cabal`.","Updated `CHANGELOG.md` and maintained the required task-tracking artifacts under `tasks/todo/2026-03-09-bound-child-helper-consolidation/`.","Validation passed: focused `boundFlexChildren returns flex TyVar` and `checkNoGenFallback accepts forall binders with direct flex children`, then full `cabal build all && cabal test` with `1006 examples, 0 failures`."]}